{
  "domain": "{{product.option.domain}}",
  "ns1": "ns1.icnanycast.com",
  "ns2": "ns2.icnanycast.com",
  "ns3": "{{product.option.ns3}}",
  "ns4": "{{product.option.ns4}}",
  "numyears": "{{order.quantity|default(1)}}",
  "autoRenew": "0",
  "email": "{{customer.email}}",
  "phonenumber": "{{customer.phone}}",
  "country": "{{customer.country}}",
  "firstname": "{{customer.firstname}}",
  "lastname": "{{customer.lastname}}",
  "address1": "{{customer.address}}",
  "address2": "",
  "city": "{{customer.city}}",
  "postcode": "{{customer.postal_code}}",
  "companyname": "{{customer.company.name}}",
  "state": "",
  "jobtitle": "manager"
}